<?xml version="1.0" encoding="UTF-8" ?>
<xs:schema 
    xmlns:xs="http://www.w3.org/2001/XMLSchema" 
    xmlns:m="http://www.rubicon-it.com/Commons/Web/ExecutionEngine/UrlMapping/1.0" 
    elementFormDefault="qualified" 
    attributeFormDefault="unqualified" 
    targetNamespace="http://www.rubicon-it.com/Commons/Web/ExecutionEngine/UrlMapping/1.0" 
    xml:lang="en">

  <!--<xs:import namespace="http://www.rubicon-it.com/Commons/Types" schemaLocation="Types.xsd" />-->

  <xs:element name="urlMapping">
    <xs:complexType>
      <xs:sequence>
        <xs:element name="add" type="m:mappingEntry" maxOccurs="unbounded" />
      </xs:sequence>
	    <xs:attribute name="application" type="m:requiredStringType" use="optional" />
    </xs:complexType>
    
    <xs:key name="resourceKey">
      <xs:selector xpath="m:add" />
      <xs:field xpath="@resource" />
    </xs:key>
    
  </xs:element>

  <xs:complexType name="mappingEntry">
    <xs:attribute name="type" type="m:dotNetType" use="required" />
    <xs:attribute name="resource" type="m:requiredStringType" use="required" />
  </xs:complexType>
  
	<xs:simpleType name="requiredStringType">
		<xs:restriction base="xs:string">
			<xs:minLength value="1" />
			<xs:whiteSpace value="collapse" />
		</xs:restriction>
	</xs:simpleType>
	
	<xs:simpleType name="dotNetType">
		<xs:restriction base="m:requiredStringType">
			<xs:pattern value=".+,.+" />
		</xs:restriction>				
	</xs:simpleType>

</xs:schema>
